{"applicableProfiles":[{"id":"ordered-map-ascii-fold","kind":"realizationProfile","version":"0.1.0"}],"assumptions":["The adapter faithfully exposes the named Realization."],"concern":"law.conformance","exclusions":["No behavior outside the exact bounded campaign is asserted."],"governingSpecification":{"id":"ordered-map","kind":"specification","version":"0.1.0"},"id":"ordered-map-typescript-put-new-appends","kind":"claim","proposition":{"declarationId":"put-new-appends","specification":{"id":"ordered-map","kind":"specification","version":"0.1.0"}},"scope":"ordered-map-typescript through ordered-map-typescript-json-adapter under ordered-map-ascii-fold.","state":"active","subject":{"id":"ordered-map-typescript","kind":"realization","version":"0.1.0"},"version":"0.1.0"}
