{"kind":"claim","id":"stack-rust-persistence","version":"0.2.0","subject":{"kind":"realization","id":"stack-rust","version":"0.2.0"},"governingSpecification":{"kind":"specification","id":"stack","version":"0.2.0"},"proposition":{"specification":{"kind":"specification","id":"stack","version":"0.2.0"},"declarationId":"persistence"},"concern":"resource.persistence","scope":"Unexercised stack-rust candidate under Stack 0.2.0 and stack-default.","assumptions":["The unchanged adapter may expose the candidate but has not been checked against Stack 0.2.0."],"exclusions":["No predecessor Evidence migrates to this Claim."],"applicableProfiles":[{"kind":"realizationProfile","id":"stack-default","version":"0.1.0"}],"state":"active"}
