{"kind":"claim","id":"stack-typescript-persistence","version":"0.1.0","subject":{"kind":"realization","id":"stack-typescript","version":"0.1.0"},"governingSpecification":{"kind":"specification","id":"stack","version":"0.1.0"},"proposition":{"specification":{"kind":"specification","id":"stack","version":"0.1.0"},"declarationId":"persistence"},"concern":"resource.persistence","scope":"stack-typescript through stack-typescript-json-adapter under stack-default.","assumptions":["The adapter faithfully exposes the named Realization."],"exclusions":["Handle behavior after process termination is not asserted."],"applicableProfiles":[{"kind":"realizationProfile","id":"stack-default","version":"0.1.0"}],"state":"active"}
