{"applicableProfiles":[{"id":"ordered-map-native-process","kind":"realizationProfile","version":"0.1.0"}],"assumptions":["The adapter faithfully exposes the named Realization."],"concern":"resource.persistence","exclusions":["No behavior outside the exact bounded campaign is asserted."],"governingSpecification":{"id":"ordered-map","kind":"specification","version":"0.1.0"},"id":"ordered-map-rust-persistence","kind":"claim","proposition":{"declarationId":"persistence","specification":{"id":"ordered-map","kind":"specification","version":"0.1.0"}},"scope":"ordered-map-rust through ordered-map-rust-json-adapter under ordered-map-native-process.","state":"active","subject":{"id":"ordered-map-rust","kind":"realization","version":"0.2.0"},"version":"0.2.0"}
