{"applicableProfiles":[{"id":"ordered-map-ascii-fold","kind":"realizationProfile","version":"0.1.0"}],"assumptions":["Reported events are complete for the adapter-observed boundary."],"concern":"effect.conformance","exclusions":["Effects outside the adapter-reported invocation boundary are not observed."],"governingSpecification":{"id":"ordered-map","kind":"specification","version":"0.1.0"},"id":"ordered-map-typescript-ordered-map-effects","kind":"claim","proposition":{"declarationId":"ordered-map-effects","specification":{"id":"ordered-map","kind":"specification","version":"0.1.0"}},"scope":"adapter-reported invocation events for ordered-map-typescript through ordered-map-typescript-json-adapter under ordered-map-ascii-fold.","state":"active","subject":{"id":"ordered-map-typescript","kind":"realization","version":"0.1.0"},"version":"0.1.0"}
