{"kind":"claim","id":"stack-rust-stack-effects","version":"0.2.0","subject":{"kind":"realization","id":"stack-rust","version":"0.2.0"},"governingSpecification":{"kind":"specification","id":"stack","version":"0.2.0"},"proposition":{"specification":{"kind":"specification","id":"stack","version":"0.2.0"},"declarationId":"stack-effects"},"concern":"effect.conformance","scope":"Unexercised adapter event boundary for Stack 0.2.0, including optional metrics.emit.","assumptions":["Reported events would need fresh review for the revised effect vocabulary."],"exclusions":["No predecessor Evidence migrates to this Claim.","No external-effect conclusion."],"applicableProfiles":[{"kind":"realizationProfile","id":"stack-default","version":"0.1.0"}],"state":"active"}
