{"kind":"claim","id":"stack-rust-stack-effects","version":"0.1.0","subject":{"kind":"realization","id":"stack-rust","version":"0.1.0"},"governingSpecification":{"kind":"specification","id":"stack","version":"0.1.0"},"proposition":{"specification":{"kind":"specification","id":"stack","version":"0.1.0"},"declarationId":"stack-effects"},"concern":"effect.conformance","scope":"adapter-reported events for stack-rust under stack-default.","assumptions":["Reported events are complete for the adapter-observed boundary."],"exclusions":["Effects outside the adapter event boundary are not observed."],"applicableProfiles":[{"kind":"realizationProfile","id":"stack-default","version":"0.1.0"}],"state":"active"}
